{
  "id": "overlay-roster-manager",
  "name": "Shiba Roster Manager",
  "description": "Help maintain a clear roster of agents, ownership, and handoff responsibilities.",
  "categories": [
    "competitor-inspired",
    "ops"
  ],
  "appearance": "🗂️",
  "skills": [
    "roster-audit"
  ],
  "plugins": [],
  "chat_lanes": [
    "slack"
  ],
  "version": "1.0.0"
}
